{"schema_version":1,"message_id":"01JZ0000000000000000000002","sender":{"agent_id":"envoy","workspace":"aae-orc"},"recipient":{"address":"broadcast://aae-orc/ops"},"performative":"INFORM","authority":{"strength":"relayed","seat":{"role":"supervisor","key":"presence.ops.supervisor.01JZ","epoch":7}},"content":{"type":"signal"},"sent_at":"2026-09-12T23:40:00Z"}
