{"schema_version":1,"message_id":"01JZ0000000000000000000001","sender":{"agent_id":"planner","workspace":"aae-orc","session":null,"principal":null},"recipient":{"address":"role://ops/supervisor"},"performative":"REQUEST","authority":{"strength":"direct","seat":null},"content":{"type":"task","data":"review","refs":["bd:aae-orc-b69n"]},"sent_at":"2026-09-12T23:40:00Z"}
